{
  "get": "fixtures",
  "parameters": {
    "id": "1534911"
  },
  "fixture_id": "bayern_madrid_ucl_qf_l2",
  "lock_at_utc": "2026-04-15T18:00:00+00:00",
  "context_pack": {},
  "errors": [],
  "results": 1,
  "paging": {
    "current": 1,
    "total": 1
  },
  "response": [
    {
      "fixture": {
        "id": 1540841,
        "referee": null,
        "timezone": "UTC",
        "date": "2026-04-15T19:00:00+00:00",
        "timestamp": 1776279600,
        "periods": {
          "first": null,
          "second": null
        },
        "venue": {
          "id": null,
          "name": "Allianz Arena",
          "city": "Munich"
        },
        "status": {
          "long": "Not Started",
          "short": "NS",
          "elapsed": null,
          "extra": null
        }
      },
      "league": {
        "id": 2,
        "name": "UEFA Champions League",
        "country": "World",
        "logo": "https://media.api-sports.io/football/leagues/2.png",
        "flag": null,
        "season": 2025,
        "round": "Quarter-finals",
        "standings": true
      },
      "teams": {
        "home": {
          "id": 157,
          "name": "Bayern München",
          "logo": "https://media.api-sports.io/football/teams/157.png",
          "winner": null
        },
        "away": {
          "id": 541,
          "name": "Real Madrid",
          "logo": "https://media.api-sports.io/football/teams/541.png",
          "winner": null
        }
      },
      "goals": {
        "home": null,
        "away": null
      },
      "score": {
        "halftime": {
          "home": null,
          "away": null
        },
        "fulltime": {
          "home": null,
          "away": null
        },
        "extratime": {
          "home": null,
          "away": null
        },
        "penalty": {
          "home": null,
          "away": null
        }
      },
      "events": [],
      "lineups": [],
      "statistics": [],
      "players": []
    }
  ],
  "snapshot_hash": "100c76d5fb71138fd6937b8e6fc58d3f5bfd24c73f26cd0d17aa21607b7035c3"
}