{
  "get": "fixtures",
  "parameters": {
    "id": "1544371"
  },
  "errors": [],
  "results": 1,
  "paging": {
    "current": 1,
    "total": 1
  },
  "response": [
    {
      "fixture": {
        "id": 1544371,
        "referee": "D. Siebert",
        "timezone": "UTC",
        "date": "2026-05-30T16:00:00+00:00",
        "timestamp": 1780156800,
        "periods": {
          "first": null,
          "second": null
        },
        "venue": {
          "id": null,
          "name": "Puskas Arena",
          "city": "Budapest"
        },
        "status": {
          "long": "Not Started",
          "short": "NS",
          "elapsed": null,
          "extra": null
        }
      },
      "league": {
        "id": 2,
        "name": "UEFA Champions League",
        "country": "World",
        "logo": "https://media.api-sports.io/football/leagues/2.png",
        "flag": null,
        "season": 2025,
        "round": "Final",
        "standings": true
      },
      "teams": {
        "home": {
          "id": 85,
          "name": "Paris Saint Germain",
          "logo": "https://media.api-sports.io/football/teams/85.png",
          "winner": null
        },
        "away": {
          "id": 42,
          "name": "Arsenal",
          "logo": "https://media.api-sports.io/football/teams/42.png",
          "winner": null
        }
      },
      "goals": {
        "home": null,
        "away": null
      },
      "score": {
        "halftime": {
          "home": null,
          "away": null
        },
        "fulltime": {
          "home": null,
          "away": null
        },
        "extratime": {
          "home": null,
          "away": null
        },
        "penalty": {
          "home": null,
          "away": null
        }
      },
      "events": [],
      "lineups": [],
      "statistics": [],
      "players": []
    }
  ],
  "fixture_id": "UEFA-Champions-League_Paris-Saint-Germain_Arsenal_2026-05-30",
  "lock_at_utc": "2026-05-29T16:00:00+00:00",
  "context_pack": {}
}